{
  "schema_version": "1.0.0",
  "generated_at": "2026-10-02T06:30:00Z",
  "source": "fixture",
  "availability": {
    "status": "unavailable",
    "reason_code": "engine_gap",
    "blocked_by": [
      "G3"
    ],
    "detail": "No hay corrida registrada: el estado agregado no se persiste."
  },
  "complete": false,
  "stages": [],
  "studies": []
}
